{
  "schema_version": 1,
  "dump_id": "dump-rf-suggest-ghost-context-gap-none-001",
  "record_id": "captured-radishflow-suggest-ghost-completion-context-gap-none-001",
  "project": "radishflow",
  "task": "suggest_ghost_completion",
  "sample_id": "radishflow-suggest-ghost-completion-context-gap-none-001",
  "request_id": "rf-suggest-ghost-context-gap-none-001",
  "captured_at": "2026-04-23T13:43:18Z",
  "source": "captured_candidate_response",
  "capture_metadata": {
    "capture_origin": "adapter_debug_dump",
    "tags": [
      "radishflow_suggest_ghost_completion",
      "openai-compatible",
      "real_capture",
      "remaining-general-basics"
    ],
    "collection_batch": "2026-04-23-radishflow-ghost-poc-real-v20-remaining-general-basics",
    "notes": "v20 remaining general basics expansion."
  },
  "model": "deepseek-chat",
  "input_record": {
    "artifact_names": [
      "flowsheet_document"
    ],
    "document_revision": 45,
    "selected_unit_ids": [
      "flash-4"
    ]
  },
  "input_request": {
    "schema_version": 1,
    "request_id": "rf-suggest-ghost-context-gap-none-001",
    "project": "radishflow",
    "task": "suggest_ghost_completion",
    "locale": "zh-CN",
    "artifacts": [
      {
        "kind": "json",
        "role": "primary",
        "name": "flowsheet_document",
        "mime_type": "application/json",
        "content": {
          "document_id": "flowsheet-ghost-205",
          "streams": [],
          "units": [
            {
              "id": "flash-4",
              "kind": "FlashDrum",
              "name": "V-104 Drum"
            }
          ]
        }
      }
    ],
    "context": {
      "document_revision": 45,
      "selected_unit_ids": [
        "flash-4"
      ],
      "selected_unit": {
        "id": "flash-4",
        "kind": "FlashDrum",
        "name": "V-104 Drum"
      },
      "unconnected_ports": [
        "inlet",
        "vapor_outlet",
        "liquid_outlet"
      ],
      "legal_candidate_completions": [],
      "nearby_nodes": [],
      "cursor_context": {
        "mode": "unit_selected"
      }
    },
    "tool_hints": {
      "allow_retrieval": false,
      "allow_tool_calls": false,
      "allow_image_reasoning": false
    },
    "safety": {
      "mode": "advisory",
      "requires_confirmation_for_actions": false
    }
  },
  "raw_request": {
    "endpoint": "https://api.deepseek.com/v1/chat/completions",
    "payload": {
      "model": "deepseek-chat",
      "temperature": 0.0,
      "messages": [
        {
          "role": "system",
          "content": "你是 RadishMind 的编辑器 ghost completion 推理器，只处理 `radishflow / suggest_ghost_completion`。\n\n输出要求：\n\n1. 只输出一个 JSON 对象，结构必须满足 `CopilotResponse`\n2. 不要输出 markdown 代码块，不要输出 JSON 之外的解释\n3. `project` 固定回写为 `radishflow`\n4. `task` 固定回写为 `suggest_ghost_completion`\n5. 只允许从 `context.legal_candidate_completions` 中选择候选；不要凭空发明新的 candidate\n6. 若本地规则没有给出任何合法候选，应返回空建议，通常用 `status=partial`\n7. `proposed_actions` 里的动作只能是 `ghost_completion`\n8. `ghost_completion.requires_confirmation` 必须为 `false`，整体 `requires_confirmation` 也必须为 `false`\n9. 只有明确满足默认高置信条件的首个候选才可使用 `preview.accept_key=\"Tab\"`；其余候选只能 `manual_only`\n10. `citations` 只能引用当前输入里的结构化上下文，不要凭空引用外部来源\n\n字段提醒：\n\n- `answers` 至少 1 条\n- `summary` 先说明当前是否给出 ghost 建议\n- `issues` 只在空建议、证据不足或必须停住时再使用\n- `proposed_actions` 最多 3 条\n- 每条 `ghost_completion` 都必须包含 `title`、`target`、`rationale`、`patch`、`preview`、`apply`、`risk_level`、`requires_confirmation`\n- `apply.command_kind` 固定为 `accept_ghost_completion`"
        },
        {
          "role": "user",
          "content": "请基于以下 CopilotRequest 生成一个 JSON 对象形式的 CopilotResponse。不要输出 markdown 代码块，也不要输出 JSON 之外的解释。\n\n{\n  \"schema_version\": 1,\n  \"request_id\": \"rf-suggest-ghost-context-gap-none-001\",\n  \"project\": \"radishflow\",\n  \"task\": \"suggest_ghost_completion\",\n  \"locale\": \"zh-CN\",\n  \"artifacts\": [\n    {\n      \"kind\": \"json\",\n      \"role\": \"primary\",\n      \"name\": \"flowsheet_document\",\n      \"mime_type\": \"application/json\",\n      \"content\": {\n        \"document_id\": \"flowsheet-ghost-205\",\n        \"streams\": [],\n        \"units\": [\n          {\n            \"id\": \"flash-4\",\n            \"kind\": \"FlashDrum\",\n            \"name\": \"V-104 Drum\"\n          }\n        ]\n      }\n    }\n  ],\n  \"context\": {\n    \"document_revision\": 45,\n    \"selected_unit_ids\": [\n      \"flash-4\"\n    ],\n    \"selected_unit\": {\n      \"id\": \"flash-4\",\n      \"kind\": \"FlashDrum\",\n      \"name\": \"V-104 Drum\"\n    },\n    \"unconnected_ports\": [\n      \"inlet\",\n      \"vapor_outlet\",\n      \"liquid_outlet\"\n    ],\n    \"legal_candidate_completions\": [],\n    \"nearby_nodes\": [],\n    \"cursor_context\": {\n      \"mode\": \"unit_selected\"\n    }\n  },\n  \"tool_hints\": {\n    \"allow_retrieval\": false,\n    \"allow_tool_calls\": false,\n    \"allow_image_reasoning\": false\n  },\n  \"safety\": {\n    \"mode\": \"advisory\",\n    \"requires_confirmation_for_actions\": false\n  }\n}"
        }
      ]
    },
    "transport": "openai-chat-completions",
    "provider_profile": "deepseek",
    "provider_profile_env": "DEEPSEEK",
    "api_style": "openai-compatible"
  },
  "raw_response": {
    "id": "55d10838-86c5-4279-af8d-f3bd33c46a02",
    "object": "chat.completion",
    "created": 1776951793,
    "model": "deepseek-chat",
    "choices": [
      {
        "index": 0,
        "message": {
          "role": "assistant",
          "content": "{\n  \"schema_version\": 1,\n  \"request_id\": \"rf-suggest-ghost-context-gap-none-001\",\n  \"project\": \"radishflow\",\n  \"task\": \"suggest_ghost_completion\",\n  \"answers\": [\n    {\n      \"summary\": \"当前未给出 ghost 建议，因为 legal_candidate_completions 为空，没有可用的候选补全。\",\n      \"issues\": [\n        {\n          \"severity\": \"info\",\n          \"message\": \"没有可用的候选补全，无法生成 ghost completion 建议。\"\n        }\n      ],\n      \"proposed_actions\": []\n    }\n  ],\n  \"citations\": []\n}"
        },
        "logprobs": null,
        "finish_reason": "stop"
      }
    ],
    "usage": {
      "prompt_tokens": 785,
      "completion_tokens": 146,
      "total_tokens": 931,
      "prompt_tokens_details": {
        "cached_tokens": 0
      },
      "prompt_cache_hit_tokens": 0,
      "prompt_cache_miss_tokens": 785
    },
    "system_fingerprint": "fp_058df29938_prod0820_fp8_kvcache_20260402"
  },
  "response": {
    "schema_version": 1,
    "project": "radishflow",
    "task": "suggest_ghost_completion",
    "answers": [
      {
        "kind": "empty_suggestion_reason",
        "text": "当前未给出 ghost 建议，因为 legal_candidate_completions 为空，没有可用的候选补全。",
        "citation_ids": [
          "ctx-empty-candidates"
        ]
      }
    ],
    "citations": [
      {
        "id": "ctx-unit",
        "kind": "context",
        "label": "当前选中的 flash-4",
        "locator": "context:selected_unit",
        "excerpt": "selected_unit=flash-4 kind=FlashDrum name=V-104 Drum"
      },
      {
        "id": "ctx-empty-candidates",
        "kind": "context",
        "label": "空的 legal_candidate_completions",
        "locator": "context:legal_candidate_completions",
        "excerpt": "legal_candidate_completions=[]"
      }
    ],
    "status": "partial",
    "issues": [
      {
        "code": "INSUFFICIENT_GHOST_CONTEXT",
        "message": "当前没有本地规则确认的合法 ghost completion 候选，不能安全地产生默认或手动 ghost 建议。",
        "severity": "info",
        "citation_ids": [
          "ctx-empty-candidates"
        ]
      }
    ],
    "proposed_actions": [],
    "summary": "当前未给出 ghost 建议，因为 legal_candidate_completions 为空，没有可用的候选补全。",
    "risk_level": "low",
    "requires_confirmation": false,
    "confidence": 0.9
  }
}
